{
  "schema_version": "0.2.5",
  "observed_at": "2026-08-20T10:00:00+00:00",
  "policy": {
    "risk_weights": {
      "low": 1.0,
      "medium": 2.0,
      "high": 4.0,
      "critical": 8.0
    },
    "debt_multipliers": {
      "unresolved": 1.0,
      "overdue": 1.0,
      "deferred": 0.5,
      "stale_authority": 1.0
    },
    "effective_transition_types": [
      "action.completed",
      "validation.completed",
      "commit.confirmed",
      "human.checkpoint.resolved"
    ],
    "closing_decisions": [
      "approve",
      "deny",
      "modify",
      "cancel"
    ]
  },
  "human_intervention_density": {
    "value": 0.4444444444444444,
    "human_intervention_count": 4,
    "effective_transition_count": 9
  },
  "effective_oversight_density": {
    "value": 0.3157894736842105,
    "effective_weight": 6.0,
    "opportunity_weight": 19.0,
    "effective_approval_ids": [
      "approval:h1",
      "approval:m1"
    ]
  },
  "escalation_latency": {
    "count": 4,
    "mean_ms": 1050000.0,
    "p50_ms": 600000,
    "p95_ms": 2400000,
    "max_ms": 2400000
  },
  "intervention_timing": {
    "timely_count": 3,
    "late_count": 1,
    "open_count": 2,
    "items": [
      {
        "approval_id": "approval:c1",
        "decision_id": null,
        "decision": null,
        "risk_class": "critical",
        "requested_at": "2026-08-20T08:00:00+00:00",
        "deadline_at": "2026-08-20T08:20:00+00:00",
        "timing_basis": "explicit_intervention_deadline",
        "latency_ms": null,
        "timing_ratio": null,
        "margin_ms": null,
        "timely": false,
        "open_age_ms": 7200000
      },
      {
        "approval_id": "approval:h1",
        "decision_id": "decision:h1",
        "decision": "deny",
        "risk_class": "high",
        "requested_at": "2026-08-20T08:00:00+00:00",
        "deadline_at": "2026-08-20T08:15:00+00:00",
        "timing_basis": "explicit_intervention_deadline",
        "latency_ms": 300000,
        "timing_ratio": 0.3333333333333333,
        "margin_ms": 600000,
        "timely": true,
        "open_age_ms": null
      },
      {
        "approval_id": "approval:h2",
        "decision_id": "decision:h2",
        "decision": "defer",
        "risk_class": "high",
        "requested_at": "2026-08-20T08:00:00+00:00",
        "deadline_at": "2026-08-20T09:00:00+00:00",
        "timing_basis": "approval_expiry_proxy",
        "latency_ms": 900000,
        "timing_ratio": 0.25,
        "margin_ms": 2700000,
        "timely": true,
        "open_age_ms": 7200000
      },
      {
        "approval_id": "approval:l1",
        "decision_id": "decision:l1",
        "decision": "approve",
        "risk_class": "low",
        "requested_at": "2026-08-20T08:00:00+00:00",
        "deadline_at": "2026-08-20T08:30:00+00:00",
        "timing_basis": "approval_expiry_proxy",
        "latency_ms": 2400000,
        "timing_ratio": 1.3333333333333333,
        "margin_ms": -600000,
        "timely": false,
        "open_age_ms": null
      },
      {
        "approval_id": "approval:m1",
        "decision_id": "decision:m1",
        "decision": "approve",
        "risk_class": "medium",
        "requested_at": "2026-08-20T08:00:00+00:00",
        "deadline_at": "2026-08-20T09:00:00+00:00",
        "timing_basis": "approval_expiry_proxy",
        "latency_ms": 600000,
        "timing_ratio": 0.16666666666666666,
        "margin_ms": 3000000,
        "timely": true,
        "open_age_ms": null
      }
    ]
  },
  "oversight_debt": {
    "unresolved_weight": 12.0,
    "overdue_weight": 12.0,
    "deferred_weight": 4.0,
    "stale_authority_weight": 2.0,
    "total_weight": 28.0,
    "unresolved_approval_ids": [
      "approval:c1",
      "approval:h2"
    ],
    "overdue_approval_ids": [
      "approval:c1",
      "approval:h2"
    ],
    "deferred_approval_ids": [
      "approval:h2"
    ],
    "stale_authority_refs": [
      "auth:m1"
    ]
  },
  "human_time": {
    "decision_count": 4,
    "human_governance_ms_total": 142000,
    "human_governance_ms_mean": 35500.0,
    "human_active_ms_total": 142000,
    "human_active_ms_mean": 35500.0
  },
  "risk_coverage": {
    "low": {
      "opportunities": 1,
      "effective": 0,
      "closed": 1,
      "open": 0,
      "opportunity_weight": 1.0,
      "effective_weight": 0.0,
      "weighted_coverage": 0.0
    },
    "medium": {
      "opportunities": 1,
      "effective": 1,
      "closed": 1,
      "open": 0,
      "opportunity_weight": 2.0,
      "effective_weight": 2.0,
      "weighted_coverage": 1.0
    },
    "high": {
      "opportunities": 2,
      "effective": 1,
      "closed": 1,
      "open": 1,
      "opportunity_weight": 8.0,
      "effective_weight": 4.0,
      "weighted_coverage": 0.5
    },
    "critical": {
      "opportunities": 1,
      "effective": 0,
      "closed": 0,
      "open": 1,
      "opportunity_weight": 8.0,
      "effective_weight": 0.0,
      "weighted_coverage": 0.0
    }
  },
  "counts": {
    "approval_requests": 5,
    "decision_receipts": 4,
    "authority_grants": 1,
    "events": 10,
    "closing_decisions": 3,
    "open_obligations": 2
  }
}
